{
  "task_id": "exp_075",
  "title": "exp_075 -- State-Dependent Exploration (gSDE)",
  "status": "deferred",
  "claimed_by": null,
  "hypothesis": "State-dependent exploration forces the mean to encode recovery behavior, directly reducing the deployment gap.",
  "what_to_change": "Replace i.i.d. Gaussian noise with gSDE in the PPO loop. Requires code changes to Agent class.",
  "expected_outcome": "Better mean-policy quality, smoother deployment.",
  "scope_note": "Requires non-trivial code changes. Defer until simpler interventions tested.",
  "config": null,
  "depends_on": null,
  "tags": ["training", "gsde", "paper-driven", "code-change-required"],
  "priority": 10,
  "result_summary": null,
  "result_diagnosis": null,
  "result_path": null,
  "created_at": "2026-03-28T14:00:00+00:00",
  "updated_at": "2026-03-28T14:00:00+00:00",
  "completed_at": null
}
